{
  "$schema": "../schema.json",
  "schemaVersion": 1,
  "id": "forgeheart-nomad",
  "name": "Forgeheart Nomad",
  "category": "Machine",
  "tags": ["machine", "character", "animated", "golem", "forge", "glTF"],
  "featured": false,
  "order": 70,
  "prompt": "Create a traveling forge caravan transformed into an upright war golem with a giant hammer, articulated tongs, wheel mechanisms, and a living furnace heart.",
  "description": "A soot-and-copper mobile forge with a readable war-golem silhouette, working tool arms, wheel hardware, chimney crown, and full caravan-to-warform deployment.",
  "metrics": {
    "bones": 123,
    "cubes": 130,
    "animations": 2,
    "triangles": 1430,
    "glbPrimitives": 1,
    "semanticEyes": 2
  },
  "project": "project.ashfox",
  "media": {
    "poster": "poster.png",
    "build": {
      "gif": "build.gif",
      "alt": "Forgeheart Nomad war-forge being built in ashfox"
    },
    "animation": {
      "gif": "animation.gif",
      "alt": "Forgeheart Nomad deploying from caravan mode into war-form"
    }
  },
  "agent": {
    "model": "GPT-5.6 Sol",
    "reasoning": "xhigh"
  }
}
