{
  "$schema": "../schema.json",
  "schemaVersion": 1,
  "id": "ashfox-ember-sentinel",
  "name": "Ashfox · Ember Sentinel",
  "category": "Creature",
  "tags": ["creature", "animated", "fox", "guardian", "nine-tailed", "game-ready", "semantic-eyes", "glTF", "meshopt"],
  "featured": false,
  "order": 50,
  "prompt": "Create a game-ready nine-tailed ember guardian fox with natural quadruped anatomy, forward-facing paws and claws, semantic spirit eyes, layered forged armor, and a dramatic full-tail ignition animation.",
  "description": "A fully rigged ember guardian with natural planted anatomy, nine independently articulated flame tails, semantic cyan eyes, layered armor, and one-primitive optimized GLB output.",
  "metrics": {
    "bones": 71,
    "cubes": 809,
    "animations": 2,
    "triangles": 4612,
    "glbPrimitives": 1,
    "semanticEyes": 2
  },
  "project": "project.ashfox",
  "media": {
    "poster": "poster.png",
    "build": {
      "gif": "build.gif",
      "alt": "Ashfox Ember Sentinel built from anatomy through nine articulated tails in ashfox"
    },
    "animation": {
      "gif": "animation.gif",
      "alt": "Ashfox Ember Sentinel raising and igniting all nine articulated flame tails"
    }
  },
  "agent": {
    "model": "GPT-5.6 Sol",
    "reasoning": "xhigh"
  }
}
