{
  "$schema": "../schema.json",
  "schemaVersion": 1,
  "id": "ironroot-tractor",
  "name": "Ironroot Tractor",
  "category": "Machine",
  "tags": ["machine", "animated", "tractor", "minecraft", "glTF"],
  "featured": true,
  "order": 20,
  "prompt": "Create a high-quality Minecraft-style arcane field tractor, fully textured, rigged, animated, and ready for a game.",
  "description": "An articulated field machine with driven wheels, steering, pistons, and a mechanical work cycle.",
  "metrics": {
    "bones": 108,
    "cubes": 125,
    "animations": 2,
    "triangles": 1476,
    "glbPrimitives": 1,
    "semanticEyes": 0
  },
  "project": "project.ashfox",
  "media": {
    "poster": "poster.jpg",
    "build": {
      "gif": "build.gif",
      "video": "build.mp4",
      "alt": "Ironroot Tractor being built in ashfox"
    },
    "animation": {
      "gif": "animation.gif",
      "alt": "Ironroot Tractor animation in ashfox"
    }
  },
  "agent": {
    "model": "GPT-5.6 Sol",
    "reasoning": "xhigh"
  }
}
