{
  "$schema": "../schema.json",
  "schemaVersion": 1,
  "id": "mossback-bellwalker",
  "name": "Mossback Bellwalker",
  "category": "Machine",
  "tags": ["machine", "animated", "temple", "walking", "fantasy", "glTF"],
  "featured": false,
  "order": 60,
  "prompt": "Create a six-legged walking moss temple with layered pagoda roofs, a swinging great bell, spirit lanterns, and an opening celestial observatory.",
  "description": "An ancient pilgrim shrine on six articulated stone legs, crowned by pagoda eaves, a living bell, moss growth, and a transforming star orrery.",
  "metrics": {
    "bones": 155,
    "cubes": 143,
    "animations": 2,
    "triangles": 1716,
    "glbPrimitives": 1,
    "semanticEyes": 0
  },
  "project": "project.ashfox",
  "media": {
    "poster": "poster.png",
    "build": {
      "gif": "build.gif",
      "alt": "Mossback Bellwalker shrine being built in ashfox"
    },
    "animation": {
      "gif": "animation.gif",
      "alt": "Mossback Bellwalker opening its ancient observatory"
    }
  },
  "agent": {
    "model": "GPT-5.6 Sol",
    "reasoning": "xhigh"
  }
}
