{
  "$schema": "../schema.json",
  "schemaVersion": 1,
  "id": "eclipse-cathedral-wyrm",
  "name": "Eclipse Cathedral · Reliquary Wyrm",
  "category": "Boss",
  "tags": ["boss", "creature", "animated", "dragon", "cathedral", "reliquary", "game-ready", "semantic-eyes", "glTF", "1 draw call", "meshopt", "quantized"],
  "featured": true,
  "order": 4,
  "prompt": "Create a game-ready eclipse cathedral reliquary wyrm facing west, with four correctly planted clawed legs, a deep skull with two embedded semantic eyes, enormous articulated stained-glass wings, a living eclipse core, gothic armor, and a cinematic awakening.",
  "description": "A boss-scale cathedral wyrm rebuilt around a readable quadruped silhouette, embedded semantic eyes, correctly oriented claws, articulated stained-glass wings, reliquary armor, an eclipse core, and two production-ready animation clips.",
  "metrics": {
    "bones": 88,
    "cubes": 4584,
    "animations": 2,
    "triangles": 21112,
    "glbPrimitives": 1,
    "semanticEyes": 2
  },
  "project": "project.ashfox",
  "media": {
    "poster": "poster.png",
    "build": {
      "gif": "build.gif",
      "alt": "Eclipse Cathedral Reliquary Wyrm built from an empty scene in ashfox"
    },
    "animation": {
      "gif": "animation.gif",
      "alt": "Eclipse Cathedral Reliquary Wyrm performing its eclipse awakening"
    }
  },
  "agent": {
    "model": "GPT-5.6 Sol",
    "reasoning": "xhigh"
  }
}
