{
  "$schema": "../schema.json",
  "schemaVersion": 1,
  "id": "kings-ransom-mimic",
  "name": "King's Ransom Mimic",
  "category": "Creature",
  "tags": ["creature", "boss", "animated", "mimic", "fantasy", "glTF"],
  "featured": false,
  "order": 40,
  "prompt": "Create a royal treasure chest mimic with a crooked crown, gilded filigree, articulated claws, a living lock eye, and a theatrical awakening animation.",
  "description": "A crowned vault predator with an expressive lock-eye, layered teeth, unfolding limbs, flying coins, and a full royal awakening sequence.",
  "metrics": {
    "bones": 128,
    "cubes": 113,
    "animations": 2,
    "triangles": 1332,
    "glbPrimitives": 1,
    "semanticEyes": 1
  },
  "project": "project.ashfox",
  "media": {
    "poster": "poster.png",
    "build": {
      "gif": "build.gif",
      "alt": "King's Ransom Mimic being assembled in ashfox"
    },
    "animation": {
      "gif": "animation.gif",
      "alt": "King's Ransom Mimic opening its royal vault form in ashfox"
    }
  },
  "agent": {
    "model": "GPT-5.6 Sol",
    "reasoning": "xhigh"
  }
}
